UniversidadID,Name,Descripcion,Tipo
2,Universidad Mayor de San Simón (UMSS),"Principal universidad pública de Cochabamba ofrece diversas carreras en varias disciplinas.",Publica
3,Universidad Privada del Valle (Univalle),"Universidad privada que se enfoca en la formación integral y profesional de sus estudiantes.",Privada
4,Universidad Central (UNICEN),Institución privada que ofrece una variedad de programas académicos en diferentes áreas.,Privada
5,Universidad Adventista de Bolivia (UAB),Universidad privada con enfoque en educación cristiana y programas académicos diversificados.,Privada
6,Universidad Privada Boliviana (UPB),"Ofrece programas académicos en diversas áreas conocida por su calidad educativa.",Privada
7,Universidad Técnica Privada Cosmos (Unitepc),Institución privada que se especializa en carreras técnicas y profesionales.,Privada
8,Universidad Latinoamericana (ULAT),Enfocada en la formación profesional con una amplia oferta educativa.,Privada
9,Universidad Privada Abierta Latinoamericana (UPAL),"Ofrece educación superior a distancia y presencial con diversas carreras.",Privada
10,Universidad Simón I. Patiño (USIP),Institución privada que promueve la educación integral y el desarrollo profesional.,Privada
11,Universidad Privada de Ciencias Administrativas y Tecnológicas (UCATEC),Focalizada en la formación en áreas administrativas y tecnológicas.,Privada
12,"Universidad Indígena Quechua ""Casimiro Huanca""",Promueve la educación intercultural y el desarrollo de comunidades indígenas.,Publica
13,Escuela Militar de Ingeniería (EMI),"Formación técnica y profesional con enfoque militar especializada en ingeniería.",Publica
14,"Universidad Católica Boliviana ""San Pablo"" (UCB)",Ofrece una educación basada en valores católicos con una amplia gama de programas académicos.,Privada
15,Universidad Núr,Institución privada que ofrece diversas carreras enfocadas en el desarrollo integral del estudiante.,Privada
16,Universidad Andina Simón Bolívar (UASB),Ofrece programas de posgrado y especialización en diversas áreas del conocimiento.,Pública
17,Universidad Nacional Siglo XX (UNSXX),"Enfocada en la formación técnica y profesional especialmente en áreas industriales.",Pública
18,Universidad Autónoma Gabriel René Moreno (UAGRM),"Con sede principal en Santa Cruz también tiene presencia en Cochabamba con programas específicos.",Pública
19,Universidad Autónoma Tomás Frías (UATF),"Con sede en Potosí ofrece programas académicos en Cochabamba mediante convenios.",Pública
